{
  "schema_version": "1.0.0",
  "inventory_hash": "19adf8a3e0102ff49c2ed017ac4714e908ce7f8330f72d1da77c3e58694d2e29",
  "content": {
    "inventory_id": "binance-v1-mandatory-endpoints-20260713",
    "inventory_status": "UNVALIDATED_ENGINEERING_BASELINE",
    "issued_at": "2026-07-13T00:00:00Z",
    "valid_until": "2026-07-14T00:00:00Z",
    "mandatory_endpoint_groups": {
      "fapi": [
        "REST_SERVER_TIME", "REST_UM_EXCHANGE_INFO", "REST_ORDER_BOOK_SNAPSHOT",
        "REST_LISTEN_KEY_CREATE", "REST_LISTEN_KEY_KEEPALIVE", "REST_LISTEN_KEY_CLOSE",
        "REST_POSITION_MODE_QUERY", "REST_POSITION_RISK_QUERY", "REST_ACCOUNT_QUERY", "REST_ACCOUNT_TRADES_QUERY", "REST_INCOME_HISTORY_QUERY", "REST_LEVERAGE_BRACKET_QUERY", "REST_INITIAL_LEVERAGE_CHANGE",
        "REST_OPEN_ORDERS_QUERY", "REST_ORDER_QUERY", "REST_NEW_ORDER", "REST_CANCEL_ORDER",
        "REST_NEW_ALGO_ORDER", "REST_QUERY_ALGO_ORDER", "REST_CANCEL_ALGO_ORDER", "REST_OPEN_ALGO_ORDERS"
      ],
      "fstream": [
        "MARKET_STREAM_CONNECT_PUBLIC", "MARKET_STREAM_CONNECT_MARKET", "MARKET_STREAM_CONNECT_PRIVATE",
        "MARKET_STREAM_JSON_SUBSCRIBE", "MARKET_STREAM_JSON_UNSUBSCRIBE", "MARKET_STREAM_PING", "MARKET_STREAM_PONG"
      ]
    },
    "ws_api_enabled_v1": false,
    "catalog_required_status": "SIGNED_RUNTIME",
    "catalog_coverage_rule": "EVERY_GROUP_ID_EXACTLY_ONE_CONTRACT_PER_ENABLED_APPLICABLE_AUTHORITY_WITH_FRESH_CLOSED_SOURCE_AND_COST_RULE",
    "unsupported_in_environment_action": "BLOCK_STAGE_AND_REQUIRE_SIGNED_PROBE_EVIDENCE_NO_SILENT_OMISSION",
    "missing_action": "BLOCK_ALL_NEW_BINANCE_EGRESS_AND_OPEN_P0"
  },
  "signature": null
}
